{
  "id": "neon-night-pop",
  "name": "Neon Night Pop",
  "description": "Deep night canvas, drifting magenta/cyan mesh, acid-lime accent. Chunky rounded display type that scale-pops on the beat. High energy, social-first.",
  "tags": [
    "dark",
    "neon",
    "social",
    "bold",
    "energetic",
    "gradient",
    "music"
  ],
  "mood": [
    "loud",
    "playful",
    "club"
  ],
  "bestFor": [
    "showreel",
    "music-video",
    "logo-sting",
    "kinetic-pitch"
  ],
  "colors": {
    "bg": "#0B0B1A",
    "surface": "#17172E",
    "primary": "#FFFFFF",
    "secondary": "#A9A9D6",
    "accent": "#C6FF00",
    "text": "#FFFFFF",
    "muted": "#8A8AB8",
    "gradient": [
      "#FF2E9A",
      "#3D5AFE",
      "#00E5FF"
    ]
  },
  "typography": {
    "display": {
      "family": "Unbounded",
      "weight": 800,
      "letterSpacing": -0.02,
      "case": "upper"
    },
    "body": {
      "family": "Manrope",
      "weight": 600,
      "letterSpacing": 0
    }
  },
  "motion": {
    "pace": "bouncy",
    "springs": {
      "ui": "snappy",
      "container": "playful",
      "type": "default"
    },
    "textReveal": "scale-pop",
    "staggerFrames": 3,
    "transition": "zoom",
    "transitionFrames": 8
  },
  "layout": {
    "safeMargin": 90,
    "cornerRadius": 40,
    "strokeWidth": 4,
    "grid": "none"
  },
  "texture": {
    "background": "mesh",
    "grain": 0.08,
    "vignette": 0.35
  },
  "audio": {
    "musicMood": "drive, 124-128 BPM, four-on-the-floor",
    "voiceDirection": "hype, fast, smiling",
    "sfx": "risers into impacts, claps"
  },
  "dos": [
    "Cut on every beat in the drop",
    "Lime accent for the one word that matters"
  ],
  "donts": [
    "No thin type",
    "No slow fades"
  ],
  "source": {
    "project": "seed",
    "type": null,
    "date": "2026-10-13"
  },
  "version": 1,
  "history": [
    {
      "version": 1,
      "project": "seed",
      "date": "2026-10-13",
      "note": "studio seed style"
    }
  ]
}